{"cargoArguments":["test","--locked","--no-run","--all-targets","--features","capsec-conformance-observer,cli-notify,default,host-http-server,insecure,module-runner,openssl-crypto,standard,tls-client-identity-openssl,unadvertised-dev-arming","--message-format=json"],"ibexFeatures":["capsec-conformance-observer","cli-notify","default","host-http-server","insecure","module-runner","openssl-crypto","standard","tls-client-identity-openssl","unadvertised-dev-arming"],"mode":"cargo-test-no-run-all-targets","package":{"manifestPath":"Cargo.toml","name":"ibex-runtime","version":"0.1.0"},"schema":"ibex/portable-engine-cargo-executable-set/1","targetTriple":"aarch64-apple-darwin","targets":[{"cargoTargetKind":"bench","cargoTargetKinds":["bench"],"cargoTargetName":"capsec_descriptor_authorization","logicalName":"bench/capsec_descriptor_authorization","profileTest":true,"targetKind":"bench"},{"cargoTargetKind":"bench","cargoTargetKinds":["bench"],"cargoTargetName":"compartment_overhead","logicalName":"bench/compartment_overhead","profileTest":true,"targetKind":"bench"},{"cargoTargetKind":"bench","cargoTargetKinds":["bench"],"cargoTargetName":"runtime_compare","logicalName":"bench/runtime_compare","profileTest":true,"targetKind":"bench"},{"cargoTargetKind":"bin","cargoTargetKinds":["bin"],"cargoTargetName":"ibex","logicalName":"bin/ibex","profileTest":false,"targetKind":"bin"},{"cargoTargetKind":"example","cargoTargetKinds":["example"],"cargoTargetName":"llp0024_parser_differential","logicalName":"example/llp0024_parser_differential","profileTest":true,"targetKind":"example"},{"cargoTargetKind":"test","cargoTargetKinds":["test"],"cargoTargetName":"ambient_env_requires_install","logicalName":"test/ambient_env_requires_install","profileTest":true,"targetKind":"test"},{"cargoTargetKind":"test","cargoTargetKinds":["test"],"cargoTargetName":"bootstrap_ipc","logicalName":"test/bootstrap_ipc","profileTest":true,"targetKind":"test"},{"cargoTargetKind":"test","cargoTargetKinds":["test"],"cargoTargetName":"bootstrap_loader","logicalName":"test/bootstrap_loader","profileTest":true,"targetKind":"test"},{"cargoTargetKind":"test","cargoTargetKinds":["test"],"cargoTargetName":"child_process_cleanup_contract","logicalName":"test/child_process_cleanup_contract","profileTest":true,"targetKind":"test"},{"cargoTargetKind":"test","cargoTargetKinds":["test"],"cargoTargetName":"child_process_native","logicalName":"test/child_process_native","profileTest":true,"targetKind":"test"},{"cargoTargetKind":"test","cargoTargetKinds":["test"],"cargoTargetName":"child_process_option_parse","logicalName":"test/child_process_option_parse","profileTest":true,"targetKind":"test"},{"cargoTargetKind":"test","cargoTargetKinds":["test"],"cargoTargetName":"child_process_windows","logicalName":"test/child_process_windows","profileTest":true,"targetKind":"test"},{"cargoTargetKind":"test","cargoTargetKinds":["test"],"cargoTargetName":"cli_eval","logicalName":"test/cli_eval","profileTest":true,"targetKind":"test"},{"cargoTargetKind":"test","cargoTargetKinds":["test"],"cargoTargetName":"cli_runtime_execution","logicalName":"test/cli_runtime_execution","profileTest":true,"targetKind":"test"},{"cargoTargetKind":"test","cargoTargetKinds":["test"],"cargoTargetName":"crypto_node_builtin","logicalName":"test/crypto_node_builtin","profileTest":true,"targetKind":"test"},{"cargoTargetKind":"test","cargoTargetKinds":["test"],"cargoTargetName":"crypto_node_hash_name","logicalName":"test/crypto_node_hash_name","profileTest":true,"targetKind":"test"},{"cargoTargetKind":"test","cargoTargetKinds":["test"],"cargoTargetName":"crypto_rsa_pss","logicalName":"test/crypto_rsa_pss","profileTest":true,"targetKind":"test"},{"cargoTargetKind":"test","cargoTargetKinds":["test"],"cargoTargetName":"crypto_stateless_dh","logicalName":"test/crypto_stateless_dh","profileTest":true,"targetKind":"test"},{"cargoTargetKind":"test","cargoTargetKinds":["test"],"cargoTargetName":"fs_async_owner_contract","logicalName":"test/fs_async_owner_contract","profileTest":true,"targetKind":"test"},{"cargoTargetKind":"test","cargoTargetKinds":["test"],"cargoTargetName":"hermes_compat_conformance","logicalName":"test/hermes_compat_conformance","profileTest":true,"targetKind":"test"},{"cargoTargetKind":"test","cargoTargetKinds":["test"],"cargoTargetName":"hermes_profile_provenance_contract","logicalName":"test/hermes_profile_provenance_contract","profileTest":true,"targetKind":"test"},{"cargoTargetKind":"bin","cargoTargetKinds":["bin"],"cargoTargetName":"ibex","logicalName":"test/ibex","profileTest":true,"targetKind":"test"},{"cargoTargetKind":"lib","cargoTargetKinds":["rlib","staticlib"],"cargoTargetName":"ibex_runtime","logicalName":"test/ibex_runtime","profileTest":true,"targetKind":"test"},{"cargoTargetKind":"test","cargoTargetKinds":["test"],"cargoTargetName":"insecure_process_env","logicalName":"test/insecure_process_env","profileTest":true,"targetKind":"test"},{"cargoTargetKind":"test","cargoTargetKinds":["test"],"cargoTargetName":"launcher_signal_mediation","logicalName":"test/launcher_signal_mediation","profileTest":true,"targetKind":"test"},{"cargoTargetKind":"test","cargoTargetKinds":["test"],"cargoTargetName":"llp0013_compartments","logicalName":"test/llp0013_compartments","profileTest":true,"targetKind":"test"},{"cargoTargetKind":"test","cargoTargetKinds":["test"],"cargoTargetName":"llp0024_parser_differential_archive","logicalName":"test/llp0024_parser_differential_archive","profileTest":true,"targetKind":"test"},{"cargoTargetKind":"test","cargoTargetKinds":["test"],"cargoTargetName":"module_runner_spike","logicalName":"test/module_runner_spike","profileTest":true,"targetKind":"test"},{"cargoTargetKind":"test","cargoTargetKinds":["test"],"cargoTargetName":"module_semantics_baseline","logicalName":"test/module_semantics_baseline","profileTest":true,"targetKind":"test"},{"cargoTargetKind":"test","cargoTargetKinds":["test"],"cargoTargetName":"module_semantics_native","logicalName":"test/module_semantics_native","profileTest":true,"targetKind":"test"},{"cargoTargetKind":"test","cargoTargetKinds":["test"],"cargoTargetName":"native_dns_pool","logicalName":"test/native_dns_pool","profileTest":true,"targetKind":"test"},{"cargoTargetKind":"test","cargoTargetKinds":["test"],"cargoTargetName":"native_dns_rcode","logicalName":"test/native_dns_rcode","profileTest":true,"targetKind":"test"},{"cargoTargetKind":"test","cargoTargetKinds":["test"],"cargoTargetName":"native_fetch_bridge","logicalName":"test/native_fetch_bridge","profileTest":true,"targetKind":"test"},{"cargoTargetKind":"test","cargoTargetKinds":["test"],"cargoTargetName":"native_fetch_runtime_isolation_contract","logicalName":"test/native_fetch_runtime_isolation_contract","profileTest":true,"targetKind":"test"},{"cargoTargetKind":"test","cargoTargetKinds":["test"],"cargoTargetName":"native_fs_pool","logicalName":"test/native_fs_pool","profileTest":true,"targetKind":"test"},{"cargoTargetKind":"test","cargoTargetKinds":["test"],"cargoTargetName":"native_handle_owner_posture_contract","logicalName":"test/native_handle_owner_posture_contract","profileTest":true,"targetKind":"test"},{"cargoTargetKind":"test","cargoTargetKinds":["test"],"cargoTargetName":"native_tier3_conformance","logicalName":"test/native_tier3_conformance","profileTest":true,"targetKind":"test"},{"cargoTargetKind":"test","cargoTargetKinds":["test"],"cargoTargetName":"native_worker_pin_contract","logicalName":"test/native_worker_pin_contract","profileTest":true,"targetKind":"test"},{"cargoTargetKind":"test","cargoTargetKinds":["test"],"cargoTargetName":"node_fs_builtin_eng23480","logicalName":"test/node_fs_builtin_eng23480","profileTest":true,"targetKind":"test"},{"cargoTargetKind":"test","cargoTargetKinds":["test"],"cargoTargetName":"node_fs_vectored_positional","logicalName":"test/node_fs_vectored_positional","profileTest":true,"targetKind":"test"},{"cargoTargetKind":"test","cargoTargetKinds":["test"],"cargoTargetName":"node_http_native_response_destroy","logicalName":"test/node_http_native_response_destroy","profileTest":true,"targetKind":"test"},{"cargoTargetKind":"test","cargoTargetKinds":["test"],"cargoTargetName":"node_net_builtins","logicalName":"test/node_net_builtins","profileTest":true,"targetKind":"test"},{"cargoTargetKind":"test","cargoTargetKinds":["test"],"cargoTargetName":"node_tls_builtins","logicalName":"test/node_tls_builtins","profileTest":true,"targetKind":"test"},{"cargoTargetKind":"test","cargoTargetKinds":["test"],"cargoTargetName":"node_zlib_builtin","logicalName":"test/node_zlib_builtin","profileTest":true,"targetKind":"test"},{"cargoTargetKind":"test","cargoTargetKinds":["test"],"cargoTargetName":"poll_async_throw_eng23731","logicalName":"test/poll_async_throw_eng23731","profileTest":true,"targetKind":"test"},{"cargoTargetKind":"test","cargoTargetKinds":["test"],"cargoTargetName":"portable_engine_build_consumption","logicalName":"test/portable_engine_build_consumption","profileTest":true,"targetKind":"test"},{"cargoTargetKind":"test","cargoTargetKinds":["test"],"cargoTargetName":"process_native_security","logicalName":"test/process_native_security","profileTest":true,"targetKind":"test"},{"cargoTargetKind":"test","cargoTargetKinds":["test"],"cargoTargetName":"runtime_callback_lifetime_contract","logicalName":"test/runtime_callback_lifetime_contract","profileTest":true,"targetKind":"test"},{"cargoTargetKind":"test","cargoTargetKinds":["test"],"cargoTargetName":"secure_process_env","logicalName":"test/secure_process_env","profileTest":true,"targetKind":"test"},{"cargoTargetKind":"test","cargoTargetKinds":["test"],"cargoTargetName":"session_product_conformance","logicalName":"test/session_product_conformance","profileTest":true,"targetKind":"test"},{"cargoTargetKind":"test","cargoTargetKinds":["test"],"cargoTargetName":"signal_handling","logicalName":"test/signal_handling","profileTest":true,"targetKind":"test"},{"cargoTargetKind":"test","cargoTargetKinds":["test"],"carg